{
  "registry_version": "H1-PILOT-SOURCES-1.0.0",
  "created_at": "2026-08-28T03:45:00+09:00",
  "sources": [
    {
      "source_id": "SRC-SKH-20230821-HBM3E-SAMPLE",
      "source_revision_id": "R1",
      "origin_group": "OG-SKH-20230821-HBM3E-SAMPLE",
      "title": "SK hynix Develops World's Best Performing HBM3E",
      "publisher": "SK hynix Newsroom",
      "source_type": "OFFICIAL_PRODUCT_RELEASE",
      "source_tier": "P1_EVENT",
      "primary_source": true,
      "publication_date": "2023-08-21",
      "published_at": "2023-08-21T00:00:00+09:00",
      "available_at": "2023-08-22T00:00:00+09:00",
      "availability_basis": "PUBLISHER_DATE_FALLBACK",
      "publisher_timezone": "Asia/Seoul",
      "accessed_at": "2026-08-28T03:30:00+09:00",
      "url": "https://news.skhynix.com/en/sk-hynix-develops-worlds-best-performing-hbm3e/",
      "local_archive_path": "data/h1/pilot/archive/SRC-SKH-20230821-HBM3E-SAMPLE.md",
      "content_hash": "7DAB6677EF9437318B912D63ACBE1118DAE03136FA3650572EE07FC639153692",
      "excerpt": "a customer’s evaluation of samples is underway ... plans to mass produce HBM3E from the first half of next year",
      "locator": "headline; News Highlights; body paragraphs 1-2"
    },
    {
      "source_id": "SRC-SKH-20240319-HBM3E-PRODUCTION",
      "source_revision_id": "R1",
      "origin_group": "OG-SKH-20240319-HBM3E-PRODUCTION",
      "title": "SK hynix Begins Volume Production of Industry-First HBM3E",
      "publisher": "SK hynix Newsroom",
      "source_type": "OFFICIAL_PRODUCT_RELEASE",
      "source_tier": "P1_EVENT",
      "primary_source": true,
      "publication_date": "2024-03-19",
      "published_at": "2024-03-19T00:00:00+09:00",
      "available_at": "2024-03-20T00:00:00+09:00",
      "availability_basis": "PUBLISHER_DATE_FALLBACK",
      "publisher_timezone": "Asia/Seoul",
      "accessed_at": "2026-08-28T03:30:00+09:00",
      "url": "https://news.skhynix.com/en/sk-hynix-begins-volume-production-of-industry-first-hbm3e/",
      "local_archive_path": "data/h1/pilot/archive/SRC-SKH-20240319-HBM3E-PRODUCTION.md",
      "content_hash": "934B8F1F342CCCA2E3799D4A474120D8A75009CC71CEF47AB1641A8FD8E21C3D",
      "excerpt": "has begun volume production of HBM3E ... for supply to a customer from late March",
      "locator": "News Highlights; body paragraph 1"
    },
    {
      "source_id": "SRC-MU-20230726-HBM3E-SAMPLE",
      "source_revision_id": "R1",
      "origin_group": "OG-MU-20230726-HBM3E-SAMPLE",
      "title": "Micron Delivers Industry's Fastest, Highest-Capacity HBM",
      "publisher": "Micron Investor Relations",
      "source_type": "OFFICIAL_PRODUCT_RELEASE",
      "source_tier": "P1_EVENT",
      "primary_source": true,
      "publication_date": "2023-07-26",
      "published_at": "2023-07-26T00:00:00-06:00",
      "available_at": "2023-07-27T00:00:00-06:00",
      "availability_basis": "PUBLISHER_DATE_FALLBACK",
      "publisher_timezone": "America/Denver",
      "accessed_at": "2026-08-28T03:30:00+09:00",
      "url": "https://investors.micron.com/news/press-release/2023/Micron-Delivers-Industrys-Fastest-Highest-Capacity-HBM-to-Advance-Generative-AI-Innovation-07-26-2023/default.aspx",
      "local_archive_path": "data/h1/pilot/archive/SRC-MU-20230726-HBM3E-SAMPLE.md",
      "content_hash": "0226DA4AB5665742617B729A706E22F45C70E01D10C5C84A13E463C0CB3E6344",
      "excerpt": "has begun sampling the industry’s first 8-high 24GB HBM3 Gen2 memory",
      "locator": "headline; body paragraph 1"
    },
    {
      "source_id": "SRC-MU-20230927-HBM3E-QUAL",
      "source_revision_id": "R1",
      "origin_group": "OG-MU-FY2023-Q4-PREPARED-REMARKS",
      "title": "Micron FY2023 Q4 Prepared Remarks",
      "publisher": "Micron Investor Relations",
      "source_type": "OFFICIAL_EARNINGS_MATERIAL",
      "source_tier": "P1_EVENT",
      "primary_source": true,
      "publication_date": "2023-09-27",
      "published_at": "2023-09-27T00:00:00-06:00",
      "available_at": "2023-09-28T00:00:00-06:00",
      "availability_basis": "PUBLISHER_DATE_FALLBACK",
      "publisher_timezone": "America/Denver",
      "accessed_at": "2026-08-28T03:30:00+09:00",
      "url": "https://investors.micron.com/static-files/d2608011-fd73-4d3c-b048-98976d31b827",
      "local_archive_path": "data/h1/pilot/archive/SRC-MU-20230927-HBM3E-QUAL.md",
      "content_hash": "5560FF1B1A4BDB1CBFE0C19D922DE4486EC5F2F4CCE48A6D008A4295954C644F",
      "excerpt": "Micron HBM3E is currently in qualification for NVIDIA compute products",
      "locator": "FY2023 Q4 prepared remarks, page 3, HBM3E paragraph"
    },
    {
      "source_id": "SRC-MU-20231220-HBM3E-QUAL-FINAL",
      "source_revision_id": "R1",
      "origin_group": "OG-MU-FY2024-Q1-PREPARED-REMARKS",
      "title": "Micron FY2024 Q1 Prepared Remarks",
      "publisher": "Micron Investor Relations",
      "source_type": "OFFICIAL_EARNINGS_MATERIAL",
      "source_tier": "P1_EVENT",
      "primary_source": true,
      "publication_date": "2023-12-20",
      "published_at": "2023-12-20T00:00:00-07:00",
      "available_at": "2023-12-21T00:00:00-07:00",
      "availability_basis": "PUBLISHER_DATE_FALLBACK",
      "publisher_timezone": "America/Denver",
      "accessed_at": "2026-08-28T03:30:00+09:00",
      "url": "https://investors.micron.com/static-files/4e2b9359-c174-49b6-9c68-2b938b3c33d2",
      "local_archive_path": "data/h1/pilot/archive/SRC-MU-20231220-HBM3E-QUAL-FINAL.md",
      "content_hash": "DB359BC796D29182557D0F68895B56CC73DC093CBF45F507E51688AF310E02C2",
      "excerpt": "in the final stages of qualifying our industry-leading HBM3E to be used in NVIDIA’s next generation Grace Hopper GH200 and H200 platforms",
      "locator": "FY2024 Q1 prepared remarks, HBM3E paragraph"
    },
    {
      "source_id": "SRC-MU-20240226-HBM3E-PRODUCTION",
      "source_revision_id": "R1",
      "origin_group": "OG-MU-20240226-HBM3E-PRODUCTION",
      "title": "Micron Commences Volume Production of HBM3E",
      "publisher": "Micron Investor Relations",
      "source_type": "OFFICIAL_PRODUCT_RELEASE",
      "source_tier": "P1_EVENT",
      "primary_source": true,
      "publication_date": "2024-02-26",
      "published_at": "2024-02-26T00:00:00-07:00",
      "available_at": "2024-02-27T00:00:00-07:00",
      "availability_basis": "PUBLISHER_DATE_FALLBACK",
      "publisher_timezone": "America/Denver",
      "accessed_at": "2026-08-28T03:30:00+09:00",
      "url": "https://investors.micron.com/news/press-release/2024/Micron-Commences-Volume-Production-of-Industry-Leading-HBM3E-Solution-to-Accelerate-the-Growth-of-AI-02-26-2024/default.aspx",
      "local_archive_path": "data/h1/pilot/archive/SRC-MU-20240226-HBM3E-PRODUCTION.md",
      "content_hash": "57B6B4F48E7C16AF33B6E6C567AC25D697C093139249EEF9B04984C508EC61A7",
      "excerpt": "begun volume production ... will be part of NVIDIA H200 Tensor Core GPUs, which will begin shipping in the second calendar quarter",
      "locator": "body paragraph 1"
    },
    {
      "source_id": "SRC-MSFT-20231115-AZ-H200-PLAN",
      "source_revision_id": "R1",
      "origin_group": "OG-MSFT-20231115-IGNITE",
      "title": "Microsoft Ignite 2023: AI transformation and technology",
      "publisher": "Official Microsoft Blog",
      "source_type": "OFFICIAL_PLATFORM_RELEASE",
      "source_tier": "P1_EVENT",
      "primary_source": true,
      "publication_date": "2023-11-15",
      "published_at": "2023-11-15T00:00:00-08:00",
      "available_at": "2023-11-16T00:00:00-08:00",
      "availability_basis": "PUBLISHER_DATE_FALLBACK",
      "publisher_timezone": "America/Los_Angeles",
      "accessed_at": "2026-08-28T03:30:00+09:00",
      "url": "https://blogs.microsoft.com/blog/2023/11/15/microsoft-ignite-2023-ai-transformation-and-the-technology-driving-change/",
      "local_archive_path": "data/h1/pilot/archive/SRC-MSFT-20231115-AZ-H200-PLAN.md",
      "content_hash": "E9BCEA39D07D19B8F97DE205583A20770AD4EDCF21252BF1C7F8BF1F3997E3B3",
      "excerpt": "announcing plans for the ND H200 v5 Virtual Machine Series ... featuring the upcoming NVIDIA H200 Tensor Core GPU",
      "locator": "Rethinking cloud infrastructure, bullet 6"
    },
    {
      "source_id": "SRC-MSFT-20240730-CAPEX",
      "source_revision_id": "R1",
      "origin_group": "OG-MSFT-FY2024-Q4-EARNINGS",
      "title": "Microsoft FY2024 Q4 Earnings Call",
      "publisher": "Microsoft Investor Relations",
      "source_type": "OFFICIAL_EARNINGS_MATERIAL",
      "source_tier": "P1_EVENT",
      "primary_source": true,
      "publication_date": "2024-07-30",
      "published_at": "2024-07-30T00:00:00-07:00",
      "available_at": "2024-07-31T00:00:00-07:00",
      "availability_basis": "PUBLISHER_DATE_FALLBACK",
      "publisher_timezone": "America/Los_Angeles",
      "accessed_at": "2026-08-28T03:30:00+09:00",
      "url": "https://www.microsoft.com/en-us/investor/events/fy-2024/earnings-fy-2024-q4",
      "local_archive_path": "data/h1/pilot/archive/SRC-MSFT-20240730-CAPEX.md",
      "content_hash": "EA4F16BBB45815098BE855E99FB72C38A282F6E8DD80ECF6E64A7D350FC335E1",
      "excerpt": "Capital expenditures including finance leases were $19 billion ... Cloud and AI related spend represents nearly all of total capital expenditures",
      "locator": "transcript lines 253-255"
    },
    {
      "source_id": "SRC-AZ-20241002-ND-H200-GA",
      "source_revision_id": "R1",
      "origin_group": "OG-AZ-20241002-ND-H200-GA",
      "title": "Azure ND H200 v5 series generally available",
      "publisher": "Microsoft Azure Blog",
      "source_type": "OFFICIAL_PLATFORM_RELEASE",
      "source_tier": "P1_EVENT",
      "primary_source": true,
      "publication_date": "2024-10-02",
      "published_at": "2024-10-02T00:00:00-07:00",
      "available_at": "2024-10-03T00:00:00-07:00",
      "availability_basis": "PUBLISHER_DATE_FALLBACK",
      "publisher_timezone": "America/Los_Angeles",
      "accessed_at": "2026-08-28T03:30:00+09:00",